### ISSUE TITLE
HEARTBEAT from AMF is not exiting docker container after NGAP REQ/RESP

### ISSUE THREAD

**Issue by NUCLEAR-WAR** [herlesupreeth/docker_open5gs#218]
Hi,

I'm new to docker open5gs and tying to build a test 5G SA Network, I already done it for 4G VoLTE with srsENB on other PC it perfectly worked fine, for 5G I installed srsRAN for the srsGNB and configure the address to connect to the docker host on the other PC.

After lunching srsGNB, i can see that the NGAP connecting is established, but directlly after the AMF says connection refused to gNB :
 
`08/28 20:07:37.492: [amf] INFO: gNB-N2 accepted[192.168.199.167]:43895 in ng-path module (../src/amf/ngap-sctp.c:113)
08/28 20:07:37.492: [amf] INFO: gNB-N2 accepted[192.168.199.167] in master_sm module (../src/amf/amf-sm.c:741)
08/28 20:07:37.492: [amf] INFO: [Added] Number of gNBs is now 1 (../src/amf/context.c:1185)
08/28 20:07:37.493: [amf] INFO: gNB-N2[192.168.199.167] max_num_of_ostreams : 30 (../src/amf/amf-sm.c:780)
08/28 20:07:39.661: [amf] INFO: gNB-N2[192.168.199.167] connection refused!!! (../src/amf/amf-sm.c:`

I did also tcp dump on the container and on the physical machine, i notice after NGAP REQ/RESP on the container pcap that AMF sent a HEARBEAT packet but it did not get a respond, on the physical machine pcap this packet is not there, after that i closed gNB, i see in the pcap taken in the container that the SHUTDOWN Message is reaching AMF container.

not sure what is messing here, i followed the instructions in the README file to deploy the 5G SA including uncomenting the ports under UPF and AMF and also change the UPF_ADVERTISE_IP.

I attach the logs/sa-depoly.yaml/pcaps from container and from Physical pc.

**Comment by herlesupreeth** [comment]
If you are running gNB in another host then I highly recommend to not use the docker for gNB as it a mess with docker NATing all the traffic between gNB and 5GC. In the meantime I will take a look and let you know if its easy solution for the above issue.

**Comment by Lncn** [comment]
@herlesupreeth I think I'm seeing a similar issue when trying to run docker_open5gs on a standalone server (10.34.0.35) and a gNB instance on another server (10.34.0.49) in same LAN.  See this tcpdump from the open5gs server of the gNB connecting from 10.34.0.49.  Everything seems to work, except the heartbeat request from AMF gets ABORT'd at the default docker0 bridge

```
$ sudo tcpdump -n -i any sctp
tcpdump: verbose output suppressed, use -v or -vv for full protocol decode
listening on any, link-type LINUX_SLL (Linux cooked v1), capture size 262144 bytes

12:13:09.918094 IP 10.34.0.49.50936 > 10.34.0.35.38412: sctp (1) [INIT] [init tag: 4134227848] [rwnd: 131072] [OS: 10] [MIS: 10] [init TSN: 1151115821]
12:13:09.918146 IP 10.34.0.49.50936 > 172.22.0.10.38412: sctp (1) [INIT] [init tag: 4134227848] [rwnd: 131072] [OS: 10] [MIS: 10] [init TSN: 1151115821]
12:13:09.918153 IP 10.34.0.49.50936 > 172.22.0.10.38412: sctp (1) [INIT] [init tag: 4134227848] [rwnd: 131072] [OS: 10] [MIS: 10] [init TSN: 1151115821]
12:13:09.918249 IP 172.22.0.10.38412 > 10.34.0.49.50936: sctp (1) [INIT ACK] [init tag: 2611897559] [rwnd: 106496] [OS: 10] [MIS: 10] [init TSN: 1114090191]
12:13:09.918249 IP 172.22.0.10.38412 > 10.34.0.49.50936: sctp (1) [INIT ACK] [init tag: 2611897559] [rwnd: 106496] [OS: 10] [MIS: 10] [init TSN: 1114090191]
12:13:09.918281 IP 10.34.0.35.38412 > 10.34.0.49.50936: sctp (1) [INIT ACK] [init tag: 2611897559] [rwnd: 106496] [OS: 10] [MIS: 10] [init TSN: 1114090191]
12:13:09.918545 IP 10.34.0.49.50936 > 10.34.0.35.38412: sctp (1) [COOKIE ECHO]
12:13:09.918578 IP 10.34.0.49.50936 > 172.22.0.10.38412: sctp (1) [COOKIE ECHO]
12:13:09.918583 IP 10.34.0.49.50936 > 172.22.0.10.38412: sctp (1) [COOKIE ECHO]
12:13:09.918686 IP 172.22.0.10.38412 > 10.34.0.49.50936: sctp (1) [COOKIE ACK]
12:13:09.918686 IP 172.22.0.10.38412 > 10.34.0.49.50936: sctp (1) [COOKIE ACK]
12:13:09.918718 IP 10.34.0.35.38412 > 10.34.0.49.50936: sctp (1) [COOKIE ACK]
12:13:12.488345 IP 172.22.0.10.38412 > 172.17.0.1.50936: sctp (1) [HB REQ]
12:13:12.488345 IP 172.22.0.10.38412 > 172.17.0.1.50936: sctp (1) [HB REQ]
12:13:12.488391 IP 172.17.0.1.50936 > 172.22.0.10.38412: sctp (1) [ABORT]
12:13:12.488394 IP 172.17.0.1.50936 > 172.22.0.10.38412: sctp (1) [ABORT]
12:13:14.919586 IP 10.34.0.49.50936 > 10.34.0.35.38412: sctp (1) [DATA] (B)(E) [TSN: 1151115821] [SID: 0] [SSEQ 0] [PPID 0x3c]
12:13:14.919618 IP 10.34.0.49.50936 > 172.22.0.10.38412: sctp (1) [DATA] (B)(E) [TSN: 1151115821] [SID: 0] [SSEQ 0] [PPID 0x3c]
12:13:14.919625 IP 10.34.0.49.50936 > 172.22.0.10.38412: sctp (1) [DATA] (B)(E) [TSN: 1151115821] [SID: 0] [SSEQ 0] [PPID 0x3c]
12:13:14.919665 IP 172.22.0.10.38412 > 10.34.0.49.50936: sctp (1) [ABORT]
12:13:14.919665 IP 172.22.0.10.38412 > 10.34.0.49.50936: sctp (1) [ABORT]
12:13:14.919686 IP 10.34.0.35.38412 > 10.34.0.49.50936: sctp (1) [ABORT]
```
Did you look into this problem or have any ideas?

**Comment by herlesupreeth** [comment]
@Lncn are you running gNB in a docker in another machine?? Can you tell me what you are running on docker with network 172.17.0.x and why is it communicating with 172.22.0.x network used by docker_open5gs??

**Comment by Lncn** [comment]
@herlesupreeth Yes, the gNB is on another host, for what it's worth NOT using docker, it's a custom base station.  This setup (custom gNB + docker_open5gs) works when everything runs on the same host.

172.17.0.1 is the default Docker network bridge:

```
$ ifconfig
br-9834e4e4b11d: flags=4163<UP,BROADCAST,RUNNING,MULTICAST>  mtu 1500
        inet 172.22.0.1  netmask 255.255.255.0  broadcast 172.22.0.255
        inet6 fe80::42:1fff:fe07:5c42  prefixlen 64  scopeid 0x20<link>
        ether 02:42:1f:07:5c:42  txqueuelen 0  (Ethernet)
        RX packets 84501  bytes 2511312 (2.5 MB)
        RX errors 0  dropped 0  overruns 0  frame 0
        TX packets 3340  bytes 1096187 (1.0 MB)
        TX errors 0  dropped 0 overruns 0  carrier 0  collisions 0

docker0: flags=4163<UP,BROADCAST,RUNNING,MULTICAST>  mtu 1500
        inet 172.17.0.1  netmask 255.255.0.0  broadcast 172.17.255.255
        inet6 fe80::42:8fff:fe20:a45b  prefixlen 64  scopeid 0x20<link>
        ether 02:42:8f:20:a4:5b  txqueuelen 0  (Ethernet)
        RX packets 6048900  bytes 1633343099 (1.6 GB)
        RX errors 0  dropped 0  overruns 0  frame 0
        TX packets 11367939  bytes 15497945460 (15.4 GB)
        TX errors 0  dropped 0 overruns 0  carrier 0  collisions 0
        
$ docker network ls
NETWORK ID     NAME                     DRIVER    SCOPE
a423a71ce6df   bridge                   bridge    local
c0a56fdccfc1   docker_open5gs_default   bridge    local
42e992e06a90   host                     host      local
3aee8cd5f9d2   none                     null      local
$ docker network inspect bridge
[
    {
        "Name": "bridge",
        "Id": "a423a71ce6df75286088541b520ab377fcdc5eefafa21a67b36ccd157cfae499",
        "Created": "2024-08-07T12:08:52.531704805-05:00",
        "Scope": "local",
        "Driver": "bridge",
        "EnableIPv6": false,
        "IPAM": {
            "Driver": "default",
            "Options": null,
            "Config": [
                {
                    "Subnet": "172.17.0.0/16",
                    "Gateway": "172.17.0.1"
                }
            ]
        },
        "Internal": false,
        "Attachable": false,
        "Ingress": false,
        "ConfigFrom": {
            "Network": ""
        },
        "ConfigOnly": false,
        "Containers": {
            "d110e93591662e58c825a43216948bb534f919cd582976f65e5368ef25339c82": {
                "Name": "vigorous_saha",
                "EndpointID": "5b2a307448b602b37becde2dbbe7474fb3ce7c94c2355d1f470becb560c543d3",
                "MacAddress": "02:42:ac:11:00:02",
                "IPv4Address": "172.17.0.2/16",
                "IPv6Address": ""
            }
        },
        "Options": {
            "com.docker.network.bridge.default_bridge": "true",
            "com.docker.network.bridge.enable_icc": "true",
            "com.docker.network.bridge.enable_ip_masquerade": "true",
            "com.docker.network.bridge.host_binding_ipv4": "0.0.0.0",
            "com.docker.network.bridge.name": "docker0",
            "com.docker.network.driver.mtu": "1500"
        },
        "Labels": {}
    }
]
```

To answer your question, I don't know why the AMF would be sending heartbeats to this network.  This seems like a docker networking configuration issue.  But I don't really understand SCTP connections.  Is there a persistent socket connection (ala TCP) that 172.22.0.10 (AMF) should be connected to my gNB (10.34.0.49) with?  gNB appears to connect and all `INIT`, `INIT ACK` and `COOKIE` traffic is routed properly, but `HB REQ` from AMF is not.

**Comment by NUCLEAR-WAR** [comment]
my Problem was similier, dont know why docker was acting weirdly, what I did is just clean up the whole PC and reinstalled the OS and docker from scratch, and it worked again.
My suspicion was due to another newly added Docker Network, which I later removed but Docker still think its exist.
I think the best way if you want to run gNB is to compile it and run it without docker as @herlesupreeth  suggested, this will save you lot of headaches fixing it.

**Comment by herlesupreeth** [comment]
Good point @NUCLEAR-WAR . @Lncn can you check whether there are two instances of docker-ce installed? one installed via snap and other installed via apt-get?? If there are two instances I would suggest removing both and installing only was apt-get

**Comment by Lncn** [comment]
@herlesupreeth There were not two instances of docker-ce installed.  I'm not sure what the deal was, but I was able to work around the problem on the open5gs host by just dropping ABORT messages via iptables.

`iptables -t filter -I OUTPUT -p sctp --chunk-types any ABORT -j DROP`

This just kinda masks the problem, but that's all I needed. I didn't figure out the root of the issue and don't have time.
